04HwQ,rn2kbnr/p6p/b1p1p1N1/3q1p1Q/PppPN3/4P3/1P3PPP/R1B1KB1R b KQkq - 0 11,h7g6 h5h8 f5e4 h8g8,1928,76,91,862,advantage hangingPiece middlegame short,https://lichess.org/SWBWkth7/black#22,Semi-Slav_Defense,Semi-Slav_Defense_Noteboom_Variation
04Hy1,2rq1rk1/1b3pp1/1n1b1n1p/p2Pp3/PpP1P3/3BBN1P/2Q1NPP1/R2R2K1 b - - 0 19,b6c4 d3c4 b7a6 f3d2 a6c4 d2c4,1633,75,92,1167,crushing long master middlegame quietMove,https://lichess.org/JhQBfN1E/black#38,Semi-Slav_Defense,Semi-Slav_Defense_Stoltz_Variation
04I5l,5k2/5bp1/7p/p2r4/2KB4/1PP1R1P1/P6P/8 w - - 5 36,e3f3 d5f5 c4d3 f5f3,1245,284,100,7,crushing discoveredAttack endgame short,https://lichess.org/uBo3xWMr#71,
04ILC,r5k1/pb4pp/1p1b1n1q/6N1/5P2/P2Br1P1/1P2Q2P/R3R1K1 w - - 0 23,e2e3 d6c5 e3c5 b6c5,1445,79,86,301,advantage middlegame pin short,https://lichess.org/zTRzqpj1#45,
04IXh,4r3/2R5/p1p3k1/P7/1bB2P2/6K1/8/8 b - - 1 42,c6c5 c4f7 g6f5 f7e8,1754,116,30,19,crushing endgame fork short,https://lichess.org/9pD5KEiq/black#84,
04Ih2,2Q5/1p3kp1/3p2p1/1Q1Pp3/2N1n3/P7/K1q5/8 w - - 0 33,b5b2 e4c3 a2a1 c2d1 b2c1 d1c1,1316,77,93,2747,endgame long mate mateIn3 pin,https://lichess.org/fdqGyh7K#65,
04Iqb,8/5Npk/1R6/5Pp1/rPK5/8/1r6/8 b - - 0 36,b2f2 f7g5 h7h8 b6b8,1416,76,84,377,endgame mate mateIn2 short,https://lichess.org/wVoKOKgu/black#72,
04Iqy,r1bqk1r1/pp3pbp/2n3p1/2pp4/2B5/2NP2B1/PPP2PPP/R2QK2R w KQq - 0 12,c4d5 g7c3 b2c3 d8d5,1522,75,82,506,advantage intermezzo opening short,https://lichess.org/G3COeYfi#23,Sicilian_Defense,Sicilian_Defense_Old_Sicilian
04IsZ,5k2/2rR1pp1/5b1p/1P5P/P1B5/1K2r3/8/3R4 w - - 0 36,b3b4 f6c3 b4b3 c3d4 b3a2 c7d7,2535,85,91,741,advantage discoveredAttack endgame interference long,https://lichess.org/C6DKCvIN#71,
04Ivl,4q1k1/pp3pp1/2n2n1p/8/2Np4/1P1P1BPb/PBQ2P1P/6K1 w - - 0 22,c4d6 e8e1,600,88,79,270,mate mateIn1 middlegame oneMove,https://lichess.org/e7bBJK0O#43,
04Izo,r1bb1rk1/5ppp/3p2q1/2pP2P1/ppP1PP1P/6Q1/PP1N4/1K1R3R b - - 0 24,b4b3 h4h5 g6e4 d2e4,1657,76,85,121,crushing middlegame short trappedPiece,https://lichess.org/NPUKWwTZ/black#48,
04J3X,r1b1kbnr/pp2pppp/1qnp4/1BpN4/4P3/5N2/PPPP1PPP/R1BQK2R b KQkq - 3 5,b6b5 d5c7 e8d8 c7b5,847,100,94,275,crushing fork opening short,https://lichess.org/BpqKFvyT/black#10,Sicilian_Defense,Sicilian_Defense_Closed
04J4e,8/5p1k/q5p1/2pN4/2P1QP1p/4P2P/6PK/4b3 w - - 3 31,e4e7 e1g3 h2g1 a6a1,1127,77,83,49,endgame mate mateIn2 short,https://lichess.org/XsnPdYCf#61,
04JGb,4r3/P7/6R1/8/8/5k2/6p1/5K2 w - - 0 67,f1g1 e8e1 g1h2 e1h1,1605,78,70,56,endgame mate mateIn2 rookEndgame short,https://lichess.org/IQWFMIpH#133,
04JNB,4r3/1R3p2/4pk2/6p1/4P1P1/8/5K2/8 b - - 9 53,e8e7 e4e5 f6e5 b7e7,1348,91,81,55,crushing deflection endgame rookEndgame short,https://lichess.org/7QedBIch/black#106,
04JOG,8/p7/1p4kp/1P1R2b1/P1pPr1P1/4P2P/3K4/8 b - - 0 45,e4e3 d5g5 h6g5 d2e3 g6f6 e3e4 f6e6 d4d5 e6d6 e4d4 c4c3 d4c3,1957,77,88,51,crushing endgame veryLong,https://lichess.org/2oVDuWIk/black#90,
04JOU,r1b3k1/p1p3pp/1p2pr2/1q1nQ3/7P/3P1N2/PPP2PP1/1K1R1B1R w - - 2 16,d3d4 d5c3 b1a1 b5e5 d4e5 c3d1,2239,76,89,308,advantage discoveredAttack long middlegame pin queensideAttack,https://lichess.org/QTqkzh8v#31,Scandinavian_Defense,Scandinavian_Defense_Mieses-Kotroc_Variation
04JPv,2krq2r/pp3p2/3ppNp1/2p5/PP1b2P1/3P3P/2Q4K/R1B2R2 b - - 2 21,d4f6 f1f6 h8h3 h2h3,1222,78,57,105,advantage middlegame pin short,https://lichess.org/hQ7xyD9Z/black#42,
04JQT,r2q1rk1/ppb2pp1/4pn1p/4N3/bP5B/P2B1Q2/2P2PPP/R4RK1 w - - 6 17,f1e1 c7e5 e1e5 d8d4,1621,109,100,14,crushing middlegame short,https://lichess.org/AT2FJsUD#33,Sicilian_Defense,Sicilian_Defense_Pin_Variation
04JZM,3k4/8/1p1N4/4rP2/P5P1/7b/1PP5/2K5 b - - 0 45,h3g4 d6f7 d8c7 f7e5,1426,134,82,23,advantage endgame fork short,https://lichess.org/MXAdJjrt/black#90,
04Jaa,r3kb1r/1bq2pp1/2n1p2p/P3P3/Q2BNP2/p2P1N2/6PP/R4RK1 w kq - 1 19,d4b6 c7b6 a5b6 a8a4,1398,74,96,4768,advantage middlegame short,https://lichess.org/xh8FDaWX#37,Sicilian_Defense,Sicilian_Defense_McDonnell_Attack
04JdJ,7r/3q1pk1/6n1/p4R2/1p2P3/3P2Q1/1PP3P1/1R4K1 w - - 2 33,f5a5 d7d4 g1f1 h8h1 f1e2 h1b1,1394,75,75,178,advantage endgame long skewer,https://lichess.org/26hzN69V#65,
04JfE,r2qr1k1/5pb1/1p1p1n2/p2P1QBp/7R/P1N4P/1PP3PN/6K1 w - - 1 23,h4h5 f6h5 g5d8 g7d4,2306,74,91,3603,crushing middlegame sacrifice short,https://lichess.org/92uvPtYe#45,
04Jl6,r1bq1rk1/6pp/p2p1bp1/1p2p3/4NP2/2P2Q2/PP4PP/RN2R1K1 b - - 1 20,e5f4 e4f6 g7f6 f3d5 g8g7 d5a8,2600,97,87,268,advantage clearance fork long middlegame,https://lichess.org/a3TlUHXv/black#40,
04JuW,1r2k2r/3b1pRp/3p4/1p1PpP2/4P3/pPqP1N1P/4Q3/1K4R1 w k - 1 25,e2c2 a3a2 c2a2 c3d3 a2c2 d3f3 g7g3 f3f4,1816,86,61,76,advancedPawn advantage deflection exposedKing fork middlegame veryLong,https://lichess.org/C1WyoFY1#49,
04JzE,k2r3r/pp4p1/8/Q3PP2/3p1B1q/8/PP4R1/R5K1 w - - 1 33,a5d2 h4h1 g1f2 h1a1,1096,77,94,898,advantage middlegame short skewer,https://lichess.org/0GIh0n3R#65,
04K5O,4r3/2p5/1k6/3pB3/3P4/6P1/1r4pP/R5K1 b - - 6 32,c7c5 d4c5 b6b5 e5b2,1189,82,78,150,crushing discoveredAttack endgame short,https://lichess.org/2ULntndc/black#64,
04K8u,1r2n1k1/4P1p1/p2N3p/1pp5/8/1P4P1/P1P1R1P1/6K1 w - - 1 33,e2e6 b8b6 e6h6 b6d6,1606,143,79,25,advantage endgame short,https://lichess.org/UGSSlabw#65,
04KSC,8/7k/4p3/p7/P6p/8/1PP1K3/8 b - - 0 45,e6e5 e2f3 h7g6 f3g4 e5e4 g4h4,2657,80,93,513,crushing endgame long master pawnEndgame,https://lichess.org/XDphDRKz/black#90,
04KYy,2r3k1/5p2/p3p1pP/PprpN2n/3R3P/2N1RP2/2P3K1/8 w - - 2 27,g2h3 c5c3 e3c3 c8c3,1253,76,93,3805,advantage middlegame short,https://lichess.org/By3ual48#53,
04KbJ,8/pR6/5ppk/8/2P4p/1P3P1P/P5P1/4rnBK w - - 0 43,g1f2 f1g3 h1h2 e1h1,879,80,95,1447,doubleCheck endgame hookMate mate mateIn2 short,https://lichess.org/dP1vkSDD#85,
04Kuz,3K4/p1p5/3k4/PP6/1n6/5B2/8/8 b - - 6 53,c7c5 a5a6 c5c4 b5b6 b4a6 b6a7,2306,88,70,44,advancedPawn crushing endgame long,https://lichess.org/r0Ys5rxe/black#106,
04KwW,r1b1k2r/pp4pp/1q2pp2/n7/2pPN3/2P1P2P/PP3PPR/1R1QKB2 w kq - 1 14,f1c4 a5c4 d1a4 b6c6 a4c6 b7c6,1542,74,97,2699,advantage hangingPiece long middlegame,https://lichess.org/02YV2FIh#27,Queens_Pawn_Game,Queens_Pawn_Game_Accelerated_London_System
04L0r,3r2k1/p4pp1/3q2r1/7p/7P/P1QP2P1/5P2/3RR1K1 w - - 3 26,a3a4 g6g3 f2g3 d6g3 g1h1 g3h3,2413,91,85,158,advantage endgame long sacrifice,https://lichess.org/CflSF06K#51,
04L6t,r3q1k1/5p1p/1QN3p1/1p3p2/4n3/4P3/P4PPP/3R2K1 w - - 0 27,b6b5 e4c3 c6e7 e8e7,1536,75,92,1065,crushing endgame fork short,https://lichess.org/5m7k01ju#53,
04LC0,8/4r3/2k2ppp/pR6/P4K1P/6P1/5P2/8 b - - 2 39,e7e5 b5e5 f6e5 f4e5,849,90,66,75,crushing endgame rookEndgame short,https://lichess.org/FfAbRtG1/black#78,
04LYr,2r2rk1/1p3ppB/p2p1b2/8/3q4/5R2/P5PP/1R1Q3K b - - 0 26,g8h7 f3h3 h7g8 d1h5 d4h4 h3h4 f6h4 h5h4,1361,74,95,2488,advantage clearance middlegame veryLong,https://lichess.org/8kBsDzrJ/black#52,
04LeD,r5k1/pp3r2/4Q3/3R4/7N/2P3P1/PP3q1P/6K1 w - - 1 34,g1h1 f2f1,1371,395,100,7,endgame mate mateIn1 oneMove,https://lichess.org/nO0f8g3Y#67,
04Lge,8/4b1pk/2R1P1qp/3p4/3P4/5P1P/4QP2/1rN4K w - - 5 43,h1h2 e7d6 h2h1 g6f5 f3f4 f5f4 e2c2 g7g6 h1g1 f4h2 g1f1 h2h3,1950,229,100,10,crushing endgame veryLong,https://lichess.org/hf6mhaoy#85,
04Lkb,8/kb2p3/p1np4/2n1qN1p/4P3/4QP1P/P5P1/1R5K b - - 2 34,e7e6 f3f4 e5f6 f5d6 f6d4 e3d4,1654,353,100,9,crushing long middlegame pin,https://lichess.org/5Pk4PnZh/black#68,
04LlM,8/8/k7/P7/2p1N1p1/6Kp/8/8 w - - 8 59,g3g4 h3h2 e4f2 c4c3,1347,76,85,80,advancedPawn crushing endgame knightEndgame master short,https://lichess.org/J77Gux1X#117,
04Lnq,r1bqk1nr/pppp1ppp/2n5/2b1P1B1/2B5/2P2N2/P4PPP/RN1QK2R b KQkq - 2 8,c5e7 d1d5 g8h6 g5h6,1741,74,93,1234,advantage opening short,https://lichess.org/R5lt2ZJK/black#16,Scotch_Game,Scotch_Game_Benima_Defense
04Lp0,r1br2k1/ppp2ppp/2n1p3/3q4/3P4/2Q2N2/PPP1BPPP/3R1RK1 b - - 0 12,d5a2 d4d5 e6d5 d1a1 a2a1 f1a1,2392,82,89,101,crushing long middlegame trappedPiece,https://lichess.org/7Mu9CGyH/black#24,French_Defense,French_Defense_Exchange_Variation
04Lt2,r2qr1k1/pp2bp1n/7Q/2pp4/8/1PNP1P1P/PP3P2/2KR2R1 b - - 2 17,g8h8 h6g7,887,102,74,44,mate mateIn1 middlegame oneMove,https://lichess.org/PvYV5WWg/black#34,Sicilian_Defense,Sicilian_Defense_Bowdler_Attack
04Lu6,8/8/5ppp/p1k5/P1P4P/3K4/6P1/8 b - - 0 37,g6g5 h4g5 f6g5 g2g4 c5b4 d3d4,1925,83,88,46,crushing defensiveMove endgame long pawnEndgame quietMove,https://lichess.org/pnyW63zO/black#74,
04M9L,4rrk1/p1pp1p2/1p4P1/8/8/P1P5/5qP1/R1KQ3R b - - 0 23,f2g2 d1h5 g2h1 h5h1,2444,84,82,372,advantage endgame quietMove short,https://lichess.org/B6RI4Oe6/black#46,
04MDt,8/5R2/p1r2bp1/5k1p/5P1P/4B1P1/3K4/8 w - - 2 49,e3d4 c6d6 d2e3 d6d4,1443,75,83,472,crushing endgame master pin short,https://lichess.org/i6Z7MF3V#97,
04MEU,1k1r3r/3b1pp1/Bp1p3p/p2Pp3/6P1/K1QP4/P6q/1R6 b - - 1 28,b8a7 c3c7 a7a6 c7b6,1197,125,81,48,mate mateIn2 middlegame sacrifice short,https://lichess.org/vFizGRSR/black#56,
04MM6,2K5/5r2/2kbR3/7p/3B2p1/6P1/3P1P1P/8 w - - 6 61,d4e5 f7f8 e6e8 f8e8,1582,76,96,8043,endgame mate mateIn2 short,https://lichess.org/FqUFqPdO#121,
04MT4,8/p5R1/7p/1pq1Bp1k/5P2/7P/P5PK/8 b - - 1 34,c5c4 g2g4 f5g4 h3g4 h5h4 e5f6,1280,87,100,80,endgame long mate mateIn3,https://lichess.org/qspyCaEo/black#68,
04MUq,r4rk1/1bpn1pb1/1p3qpp/p2Pp3/P3P3/1Q3N2/3N1PPP/1BR2RK1 b - - 1 21,d7c5 c1c5 b6c5 b3b7,1268,79,86,1131,advantage capturingDefender middlegame short,https://lichess.org/Gu0Y21gP/black#42,
04MdN,r1b1r1k1/pp2qp1p/2n1p1pQ/3p3N/3P4/2PB4/P4PPP/R4RK1 b - - 2 17,e7f8 h5f6 g8h8 h6h7,1226,77,96,252,fork mate mateIn2 middlegame short,https://lichess.org/0p6uARIs/black#34,Sicilian_Defense,Sicilian_Defense_Morphy_Gambit
04Mis,r1b3k1/5rpp/p1n1Np2/1p1n4/2pP1q2/2P2N2/PPB2PPP/R2QR1K1 w - - 1 18,c2e4 c8e6 e4h7 g8h7,1401,76,86,376,advantage hangingPiece middlegame short,https://lichess.org/aQ1CjDrE#35,Sicilian_Defense,Sicilian_Defense_Old_Sicilian
04Mmx,4r1k1/4P1pb/r6p/p1p1p3/P2p2PP/1P3R2/2P2R2/6K1 b - - 0 40,a6e6 f3f8 e8f8 e7f8q,600,94,91,148,advancedPawn endgame mate mateIn2 promotion short,https://lichess.org/GntOxvvC/black#80,
04Mor,r1b1r1k1/pppnqpbp/3p1np1/6N1/2PPp3/4P1P1/PPQ2PBP/RNBR2K1 w - - 2 11,g5e4 f6e4 g2e4 e7e4 c2e4 e8e4,1332,139,38,16,advantage long opening,https://lichess.org/xq9y5a2o#21,Kings_Indian_Defense,Kings_Indian_Defense_Normal_Variation
04Mtz,rn1qk2r/pbppnpb1/1p2p3/4P2p/2PP2pB/2N5/PP1N1PPP/R2QKB1R b KQkq - 1 11,f7f5 e5f6 g7f6 h4f6,1435,81,72,694,crushing enPassant fork opening short,https://lichess.org/8FDcdoZx/black#22,Modern_Defense,Modern_Defense_Other_variations
04Mua,6k1/R4p2/P3p2p/3p1rp1/8/8/5r2/R5K1 b - - 5 42,f2b2 a7b7 b2e2 a6a7 f5f2 a7a8q,1889,74,91,735,advancedPawn advantage endgame long master masterVsMaster promotion rookEndgame,https://lichess.org/VJsRZsLH/black#84,
04Muh,r3k1nr/1pp1bppp/p1n1p1q1/4P2b/P2P4/2N1BN2/1P2BPPP/R2Q1RK1 w kq - 3 13,e2d3 h5f3 d3g6 f3d1 g6f7 e8f7,1209,75,86,456,advantage long middlegame pin,https://lichess.org/1XAGdFhE#25,Queens_Pawn_Game,Queens_Pawn_Game_Zukertort_Variation
04N9V,1b2rrk1/1R4pp/8/1pPp4/3Np2q/2P1Q3/1P3PPP/4R1K1 w - - 2 23,h2h3 b8f4 e3e2 e4e3 d4f3 e3f2,2135,85,72,30,advancedPawn advantage kingsideAttack long middlegame,https://lichess.org/n3fKqYIp#45,
04NDb,1k1r4/p1q2pp1/Qp2p3/3n3p/1b5P/1N3BP1/P4PK1/2R5 b - - 4 27,d5c3 a2a3 c7c8 a6c8 d8c8 a3b4,1733,73,94,3896,advantage long master middlegame,https://lichess.org/iugvSqJM/black#54,
04NEC,1k5r/1pp4p/p7/3r4/3n2Q1/1P6/P4PP1/2R2RK1 w - - 0 26,g4g7 d4e2 g1h1 d5h5,1500,75,97,10537,endgame fork mate mateIn2 short,https://lichess.org/glBJxTEP#51,
04NEq,rnb1kbr1/pppp1Npp/5q2/2n5/2B5/5P2/PPPP2PP/RNBQK2R w KQq - 1 7,b1c3 f6h4 g2g3 h4c4,1616,75,93,608,advantage fork opening short,https://lichess.org/uZ73yQJE#13,Russian_Game,Russian_Game_Damiano_Variation
04NV2,7r/p5KP/1b6/8/P6R/1P1k4/8/8 b - - 8 46,b6d4 h4d4 d3d4 g7h8,1096,76,92,1029,crushing endgame short,https://lichess.org/tkbDzn7V/black#92,
04NVI,6k1/1p3p2/p1p5/4P2Q/1P3P1P/P5K1/8/6q1 w - - 1 40,g3f3 g1d1 f3g2 d1h5,1234,77,73,629,crushing endgame queenEndgame short skewer,https://lichess.org/GYwYzBnd#79,
04NVS,3r1r2/pb2qpkp/1pp1p1p1/3nPN2/3P4/P4BPR/1P3PP1/2QR1K2 b - - 1 25,e6f5 c1h6 g7h8 h6h7,1250,235,100,11,mate mateIn2 middlegame short,https://lichess.org/4OzFu6Us/black#50,
04NYp,6k1/p4p2/bp5p/3p2p1/6P1/4P1BP/P2R1PK1/2r5 w - - 5 30,d2d5 a6b7 e3e4 b7d5,1534,87,43,26,crushing endgame pin short,https://lichess.org/Njlr2Mzw#59,
04NbB,r1b2k2/p1p2p1Q/2qb3p/3p4/8/3B4/PPP2PPP/4R1K1 b - - 0 21,c8e6 e1e6 d6h2 g1h2 c6e6 h7h8 f8e7 h8a8,2160,108,73,27,crushing middlegame skewer veryLong,https://lichess.org/cMKqbSbn/black#42,
04Ncg,1r3rk1/2p4p/4pPp1/p2p2QN/7P/6P1/2q2KB1/3R3R w - - 0 32,f2g1 c2d1 g1h2 d1h5,1341,76,81,540,crushing hangingPiece middlegame short,https://lichess.org/yxRFDWJ7#63,
04Nk6,2b2r1k/p5bp/1p4p1/2p3q1/4p3/P1P1P1P1/BP1BQ2P/5RK1 b - - 8 23,c8g4 f1f8 g7f8 e2c4,1637,75,94,9602,crushing middlegame short,https://lichess.org/J6J5BYP9/black#46,
04Nyf,6k1/p3P1B1/4q1r1/1p6/2pP1Qp1/P2p1P2/1P3KP1/8 b - - 0 38,g8g7 f4f8 g7h7 e7e8q,1081,75,94,760,advancedPawn crushing endgame promotion short,https://lichess.org/5SBYMheY/black#76,
04O0s,8/8/3k1P2/2r5/1p2PK2/1B6/8/8 b - - 0 53,c5c3 e4e5 d6d7 e5e6 d7d6 e6e7 c3c8 b3f7,2664,84,87,231,advancedPawn clearance crushing endgame exposedKing veryLong,https://lichess.org/A9kDi12L/black#106,
04O8q,r3r3/1b2qpkp/p2p2n1/1ppPpQ2/4P1P1/1BP4R/PP3PP1/R5K1 b - - 4 27,e7f6 h3h7 g7h7 f5f6,1368,76,87,750,crushing deflection master middlegame short,https://lichess.org/IWH1uBLk/black#54,
04OCu,3rr1k1/ppp2ppp/1n6/8/3qp2P/PQ5R/1P2BPP1/4RK2 b - - 2 20,d4a4 b3a4 b6a4 e2b5 a4c5 b5e8,1750,76,97,7881,advantage fork long middlegame,https://lichess.org/Wu4qMxCX/black#40,
04OEL,6k1/pr4p1/1pRR3p/3pPr2/3P1p1q/P4P1P/1P1Q2P1/6K1 w - - 1 31,d6d8 h4d8 d2c2 f5f8,2099,75,91,934,advantage defensiveMove endgame hangingPiece short,https://lichess.org/Xv8RfXK9#61,
04OIv,3q2k1/pb1p2p1/1p1Pp1B1/2b2P2/2P4p/6PK/7P/4RR2 b - - 0 37,d8f6 f5e6 f6g6 e6d7 g6d6 e1e8 g8h7 d7d8q d6d8 e8d8,2187,75,87,358,advancedPawn advantage endgame promotion sacrifice veryLong,https://lichess.org/OUtjE8wm/black#74,
04OLf,2r5/5p2/b1r2k2/1pP1p1p1/4P1Pp/5N2/P4PK1/2RR4 b - - 0 34,c6c5 c1c5 c8c5 d1d6 f6e7 d6a6,1867,89,76,29,advantage endgame fork long,https://lichess.org/gHZqRW1P/black#68,
04OUJ,2k5/pp3p2/7R/3N4/5Pr1/8/Pn2r3/5R1K b - - 0 32,b2d3 h6h8 c8d7 d5f6,1071,79,94,1203,advantage endgame short,https://lichess.org/XC1Dr8OI/black#64,
04OYD,r1b1k2r/pppn3p/3bpqp1/3p1p2/3P3N/P3P1P1/1PPNBPP1/R2QK2R w KQkq - 4 11,h4g6 h7g6 h1h8 f6h8,1631,74,92,1394,advantage hangingPiece opening short,https://lichess.org/QYnRhe5u#21,Dutch_Defense,Dutch_Defense_Other_variations
04OhD,r3r1k1/pp1nqppp/2p1b3/3p4/3Pn2N/2NBP2P/PPQ2PP1/R4RK1 w - - 11 15,c3e4 d5e4 d3e4 e7h4,1636,183,-100,6,advantage middlegame short trappedPiece,https://lichess.org/HEDo5LNa#29,Queens_Gambit_Declined,Queens_Gambit_Declined_Other_variations
04OlI,r2r2k1/5ppp/B1Q5/3R1p2/8/1P6/Pq3PPP/6K1 b - - 0 23,d8d5 c6a8 d5d8 a8d8,1151,76,70,128,backRankMate endgame fork hangingPiece mate mateIn2 short,https://lichess.org/YJR0OG6l/black#46,
04On4,rnb1k2r/pp3ppp/4p3/3pN3/1qPPn3/2N5/PP3PPP/R2QKB1R w KQkq - 2 10,d1f3 b4b2 f3f7 e8d8 c3e4 b2a1,1711,75,93,2651,crushing long opening,https://lichess.org/JznYx7Aq#19,Caro-Kann_Defense,Caro-Kann_Defense_Panov_Attack
04Ov0,6k1/6pp/1p6/1b6/3pQ1N1/7P/5PPK/5q2 b - - 0 36,f1c4 e4a8 g8f7 g4e5 f7f6 e5c4,1576,154,100,26,crushing endgame fork long,https://lichess.org/jtwmvuUW/black#72,
04Ow1,1r4k1/7p/3qP3/B1p2pp1/P2p1n1b/1P1P3P/2P4Q/R4RK1 w - - 0 29,a5d2 h4g3 d2f4 g3h2 f4h2 f5f4,2250,90,77,28,advantage defensiveMove exposedKing kingsideAttack long middlegame,https://lichess.org/yOQoEwpV#57,
04OzC,8/5kpp/pp1Q1p2/8/P2P2N1/1P3P2/2r1q2r/1R2R2K w - - 0 35,g4h2 e2g2,1909,80,63,320,endgame mate mateIn1 oneMove,https://lichess.org/ixxnFLGc#69,
04P1b,5rk1/2bB3p/pp4p1/2p5/2Pp4/PP1P4/5RQP/2B1q1K1 w - - 1 32,f2f1 c7h2 g1h2 f8f1,2109,78,89,1846,crushing deflection kingsideAttack middlegame short,https://lichess.org/09C2Poae#63,
04PCA,8/2R4p/6pk/5p2/1rBP1KPP/4PP2/8/2r5 b - - 0 41,b4c4 g4g5 h6h5 c7h7,987,76,96,1629,deflection endgame mate mateIn2 rookEndgame short,https://lichess.org/CYh3htEg/black#82,
04PFc,Q1b5/5pkp/4p1p1/P7/2q5/5B1P/5PP1/6K1 w - - 0 31,f3b7 c4c1 g1h2 c1c7,1564,74,94,1395,crushing endgame short,https://lichess.org/SFNmuL6M#61,
04PHc,6k1/p2q1pp1/1p1P1r1p/8/5Q2/1P3P2/5PKP/3R4 w - - 4 26,f4e5 f6g6 g2f1 d7h3,1310,331,100,3,crushing endgame short,https://lichess.org/qmRc04nI#51,
04PR2,6rk/p2b1nr1/np5p/2pPp3/2P1Pp1q/P1QN1P2/2B1N1P1/1R3KR1 b - - 7 32,a6c7 d3e5 f7e5 c3e5,1845,271,100,4,crushing master middlegame short,https://lichess.org/laE86ojY/black#64,
04PRG,r1b1r1k1/1p2bp2/p1qp1n1Q/4p3/4PP2/2NB4/PPP3PP/R4RK1 b - - 0 16,d6d5 e4d5 c6b6 g1h1,1393,110,100,14,crushing middlegame short,https://lichess.org/rvJwwhE4/black#32,Sicilian_Defense,Sicilian_Defense_Najdorf_Variation
04Pe7,2r3k1/pp4p1/4bq1p/8/1b1P4/2N5/PPQ1B1PP/3R2K1 b - - 1 22,e6a2 c2a4 b4c3 a4a2 f6f7 a2f7,2108,73,93,5478,advantage fork long middlegame,https://lichess.org/3vD1vJhj/black#44,
04Psq,r4rk1/5p2/2pNp3/pp1nP1pR/8/P2P4/1P6/1K5R b - - 0 28,f7f6 e5f6,2075,109,45,31,advantage endgame oneMove,https://lichess.org/rHHsnfDc/black#56,
04PvN,r1b1kb1r/5p2/2p1pP1p/2q1P2P/1BB5/p7/2K1Q3/RR6 b kq - 3 33,c5a7 a1a3 a7a3 b4a3,1442,75,95,7181,crushing middlegame short,https://lichess.org/U5TBKx0e/black#66,
04Q2g,1r6/1p2rppk/p2ppn1p/8/5P2/P1B1P2P/1P3P1K/R5R1 b - - 7 22,f6e4 g1g7 h7h8 g7f7 e4c3 f7e7,1192,107,100,53,crushing discoveredAttack endgame long,https://lichess.org/AyM1uozf/black#44,
04Q6b,r7/5k1R/2p2P2/3p4/pp6/qP1Br3/P1P1N1R1/1K6 b - - 1 28,f7f6 g2g6 f6e5 h7h5,1655,76,98,5809,mate mateIn2 middlegame short,https://lichess.org/KyoqPCST/black#56,
04QBi,2kr1b1r/pp1n1ppp/Q1p1pn2/7q/4PB2/5N2/PPP1BPPP/2KR3R b - - 7 12,h5g4 a6c6 b7c6 e2a6,1986,75,89,96,clearance mate mateIn2 middlegame queensideAttack sacrifice short,https://lichess.org/1nCYT0f6/black#24,Caro-Kann_Defense,Caro-Kann_Defense_Two_Knights_Attack
04QEw,6k1/5ppp/1pr1p3/p7/1P2P3/R3P2P/5PK1/8 b - - 0 22,a5b4 a3a8 c6c8 a8c8,853,114,57,28,backRankMate endgame mate mateIn2 rookEndgame short,https://lichess.org/u1D9YAJA/black#44,
04QKP,r2qk1nr/1p1bbppp/p3p3/3pN3/3P4/2N2Q2/PPP2PPP/R1B1K2R b KQkq - 1 9,f7f6 f3h5 g7g6 e5g6 h7g6 h5h8,1415,214,33,5,crushing long opening pin trappedPiece,https://lichess.org/bxUOkqCq/black#18,French_Defense,French_Defense_Normal_Variation
04QLZ,8/8/4k3/K4p2/4P2p/6pP/P5P1/8 b - - 0 43,f5e4 a5b4 e6d5 b4c3,1238,75,94,2626,crushing defensiveMove endgame pawnEndgame short,https://lichess.org/nFhmTDsJ/black#86,
04QOU,8/3q1pk1/4p1pp/2p1P3/1nPb4/4BQPB/1r3P1P/5R1K b - - 0 31,b4c2 f3f6 g7h7 e3h6 d4e5 f6e5,2062,74,92,111,advantage long middlegame,https://lichess.org/Y2qlQYKR/black#62,
04Qe0,8/pp3k2/1npQ4/3pP3/8/2P1b3/PP2b2q/1K1R1B2 b - - 0 26,e2d1 e5e6 f7f6 d6h2,1894,73,94,8261,crushing discoveredAttack endgame short,https://lichess.org/X3wrCQ3c/black#52,
04Qn2,3Rb2N/p3k1p1/1p1br2p/8/8/7P/PP1R1PP1/6K1 w - - 2 26,d8a8 e6e1,687,88,82,162,endgame mate mateIn1 oneMove,https://lichess.org/rygA3vEd#51,
04QpK,8/1p6/8/4k1p1/1P3p2/P1PRp1r1/4K3/2B5 w - - 0 45,c1e3 g3e3 d3e3 f4e3 e2e3 b7b5 e3f3 e5f5,2774,118,91,815,crushing defensiveMove endgame quietMove veryLong,https://lichess.org/SnhWd9Yk#89,
04QtS,5rk1/1pp3B1/4p3/Pn2N1Q1/1P1qP3/3P2nP/8/1R4K1 w - - 3 32,g1g2 d4f2,1254,77,86,619,mate mateIn1 middlegame oneMove,https://lichess.org/87ON3wgE#63,
04QuI,3r1rk1/ppp2ppp/1q6/4Q3/8/P2b1B1P/5PP1/4R1K1 b - - 0 27,f8e8 e5e8 d8e8 e1e8,668,107,88,779,backRankMate mate mateIn2 middlegame short,https://lichess.org/c56Zi6Ma/black#54,
04QwV,4r3/1qR2kpp/3rpp2/p3P3/1p3P1P/4B3/PP4P1/1KR5 b - - 1 33,b7c7 c1c7 d6d7 c7d7,864,97,86,555,crushing endgame hangingPiece short,https://lichess.org/bu6YkR3s/black#66,
04Qwc,3r3k/1bq3n1/pp4B1/8/2p5/1P2Q2P/P2N2P1/7K b - - 1 35,d8d6 e3h6 h8g8 h6h7 g8f8 h7h8 f8e7 h8g7,1431,76,81,84,crushing deflection exposedKing interference middlegame veryLong,https://lichess.org/unnqh1mu/black#70,
04QzG,rn1q1rk1/1p2n1bp/p2p2p1/1Np2b2/2P5/3B4/PP2NPPP/R1BQ1RK1 w - - 0 12,b5d6 d8d6 d3f5 e7f5 d1d6 f5d6,1500,500,100,0,crushing hangingPiece long opening,https://lichess.org/sqp7Tyce#23,Benoni_Defense,Benoni_Defense_Old_Benoni
04R0B,1r2r2k/6b1/p2pp3/7q/2p1NP2/P3R3/1PPB2Q1/6K1 b - - 5 33,g7d4 d2c3 d4c3 e3h3,2089,74,95,2172,advantage middlegame pin sacrifice short,https://lichess.org/c3om4oO7/black#66,
04R1U,4rr1k/3q2p1/2p3PQ/p1P4P/1p1BR3/5P2/PP1K4/8 b - - 0 35,h8g8 h6h7,961,80,96,1057,endgame mate mateIn1 oneMove,https://lichess.org/PUrgqosT/black#70,
04RAU,rn1qkbnr/pbp4p/1p2pp2/3pN1B1/3P4/8/PPP2PPP/RN1QKB1R b KQkq - 1 7,f6g5 d1h5 e8e7 h5f7 e7d6 b1a3,2686,99,91,1041,crushing defensiveMove exposedKing long opening,https://lichess.org/TKHdzwmH/black#14,French_Defense,French_Defense_Normal_Variation
04RCJ,1r1q1rk1/1pp2ppp/p1n5/3p1b2/3Pn3/PQN1PN2/1P2BPPP/R4RK1 w - - 6 15,c3d5 f5e6,1737,79,86,101,advantage middlegame oneMove,https://lichess.org/TNxxKzp7#29,Queens_Gambit_Declined,Queens_Gambit_Declined_Other_variations
04RMB,3R1B2/p4p1p/2p2kp1/4b3/2b1P3/7P/PPr3P1/6NK w - - 4 29,b2b3 c4f1 d8d6 e5d6,1749,131,80,10,crushing endgame short,https://lichess.org/ynDzO3bd#57,
04ROo,3r4/p1q2p1p/1p2bkp1/4R3/2Pr1P2/1PQ1R1P1/P4P1P/6K1 b - - 2 25,c7d6 e5d5 d6d5 c4d5,1959,76,93,113,crushing middlegame pin short,https://lichess.org/sRRRQ4G2/black#50,
04Rkh,r1b2r2/pp2q1p1/2p4k/2P1n1Pn/4N2P/4P3/PPQ2P2/2R1K2R b K - 0 19,h6h7 e4f6 h7h8 c2h7,1378,79,88,946,doubleCheck mate mateIn2 middlegame short,https://lichess.org/rEPWj5y4/black#38,Queens_Gambit_Declined,Queens_Gambit_Declined_Other_variations
04Ruq,8/pp5p/2p1k3/2P5/1P6/Pr5P/5RK1/8 w - - 1 38,f2f3 b3f3 g2f3 e6d5,1691,92,100,33,crushing endgame rookEndgame short,https://lichess.org/EzAc1nWD#75,
04Rwz,8/2B2k2/6p1/2n2p1p/5K1P/P5P1/8/8 w - - 7 44,f4g5 c5e6 g5h6 e6c7,1017,76,90,1109,crushing endgame fork short,https://lichess.org/YRKOirv3#87,
04Rx4,3r2k1/Qp3pp1/8/6qn/2b1P3/5P2/PP3RPP/R5K1 w - - 1 25,a7b7 g5c5 b2b4 c5d4,2125,106,85,20,crushing middlegame short,https://lichess.org/DOzwz0wl#49,
04RzI,2kr2nr/ppp2pp1/3p3p/3Np2b/2B1P2q/2PPPP1P/PP2K3/R2Q3R b - - 0 14,g8f6 d5e7 c8b8 e7f5 h4g5 h1g1,2018,75,91,751,advantage long middlegame,https://lichess.org/rNJBo9q5/black#28,Three_Knights_Opening,Three_Knights_Opening_Other_variations
04S0T,2r1r1k1/5pp1/1Qp2n1p/8/2PPp3/2P1B2q/4BP2/1R3RK1 w - - 0 23,b6c5 e8e6 e3f4 e4e3 f2e3 f6e4 c5h5 e6g6 h5g6 f7g6,2788,107,83,471,advantage clearance master middlegame quietMove veryLong,https://lichess.org/aC7IlWtO#45,
04SC7,2r2rk1/1p3pp1/p1nq3p/2Rpp3/3P4/P2QPN1P/1P3PP1/5RK1 w - - 0 18,f1c1 e5e4 d3b3 e4f3,1296,75,99,1981,crushing fork middlegame short,https://lichess.org/4omJAvJT#35,Slav_Defense,Slav_Defense_Exchange_Variation
04SG1,5rk1/6p1/2p5/p1Qp4/2b5/P5B1/6PP/4RqK1 w - - 10 37,e1f1 f8f1,1011,176,100,30,endgame mate mateIn1 oneMove,https://lichess.org/5kR6VS1w#73,
04SG4,4r3/1p5R/p2kb3/4nr2/3Q4/3P4/qPP3P1/2K1RB2 b - - 0 26,d6c6 e1e5 a2b1 c1d2 f5e5 d4e5 b1c2 d2c2,2357,94,90,704,crushing middlegame veryLong,https://lichess.org/BUyNhl0L/black#52,
04SGJ,8/2R5/2P4k/5Ppp/8/6PK/r6P/8 w - - 1 56,c7e7 g5g4 h3h4 a2h2,1032,83,88,64,deflection endgame mate mateIn2 rookEndgame short,https://lichess.org/XBGkcvav#111,
04SJe,3k3r/2b3q1/2Q1p3/3p4/3P4/BP3Rp1/5P2/6K1 w - - 0 39,f2g3 g7d4 g1g2 d4d2 f3f2 h8h2 g2h2 d2f2,1545,75,92,331,attraction crushing deflection endgame exposedKing veryLong,https://lichess.org/P2OoHSbI#77,
04SS6,6k1/5ppp/4p3/8/1r1P4/2R3P1/5PKP/8 b - - 0 33,b4d4 c3c8 d4d8 c8d8,802,134,67,24,backRankMate endgame mate mateIn2 rookEndgame short,https://lichess.org/uZVWfoso/black#66,
04SXy,8/R4pp1/pr6/7k/5K1P/5P2/8/8 w - - 0 44,a7f7 b6f6 f7f6 g7f6 f4f5 a6a5,1588,74,97,7065,crushing defensiveMove endgame long rookEndgame,https://lichess.org/XkHgsVU7#87,
04Sns,r1q1r1k1/2p2ppn/1pN1p2p/4P2P/p1PRQ3/6P1/PP3PK1/2b1R3 w - - 0 28,e1c1 h7g5 c6e7 e8e7,1261,81,84,60,advantage master middlegame short,https://lichess.org/pmkRV3oS#55,
04SpT,r1bq1rk1/pp3pp1/2np1n1p/4p3/1b2P2B/1NNB4/PPP2PPP/R2Q1RK1 b - - 1 10,d8e7 c3d5 f6d5 h4e7,1594,76,92,1134,crushing opening short,https://lichess.org/w9LDnjys/black#20,Sicilian_Defense,Sicilian_Defense_Lasker-Pelikan_Variation
04Szo,2r1kbr1/p2q2p1/1p2p2p/3p1p1Q/3B4/2P4P/P3RPP1/R5K1 b - - 1 24,d7f7 e2e6 f8e7 h5e2,2371,111,51,52,clearance crushing defensiveMove middlegame pin short,https://lichess.org/hXXrggHq/black#48,
04T59,6k1/1R3pp1/4n3/8/2N4P/3r4/P4PKP/8 w - - 3 41,c4e5 e6f4 g2f1 d3d1,819,97,91,402,endgame mate mateIn2 short,https://lichess.org/fbZl08ne#81,
04TFa,rnb1kb1r/pp3ppp/2p2n2/4p3/8/1B1P1Q2/PPP2PqP/RNB1K1NR b KQkq - 1 7,c8h3 f3h3 g2h1 h3c8 e8e7 e1f1 b8d7 c8a8,2633,87,80,119,advantage opening sacrifice veryLong,https://lichess.org/o9olxwYP/black#14,Portuguese_Opening,Portuguese_Opening_Other_variations
04TFy,1n6/1P2k2p/6p1/2pPpp2/8/3B1KPP/5P2/8 w - - 0 36,g3g4 e5e4 d3e4 f5e4,1133,87,84,55,advantage endgame fork short,https://lichess.org/M9khwz24#71,
04TQD,3r1rk1/pp2qpp1/2p1p2Q/8/8/1P4R1/6PP/5R1K b - - 0 29,g7g6 g3h3 f7f6 h6h8 g8f7 h3h7 f7e8 h7e7,1879,74,96,5629,crushing endgame quietMove skewer veryLong,https://lichess.org/lmDAzyCc/black#58,
04TeK,3B4/1b4p1/p3p1k1/1p2P3/2p2nP1/P1P2p2/BP1K1P2/8 b - - 0 30,b7e4 d2e3 e4c2 e3f4,1154,77,69,76,crushing endgame short,https://lichess.org/sJuOwZC6/black#60,
04Tlx,r5k1/1b3r1p/pp2p3/4bp2/5N1q/1Q1P4/PP3PPP/R1B2RK1 w - - 4 19,g2g3 e5f4 c1f4 h4f4,2061,93,60,43,crushing middlegame short,https://lichess.org/xKfsjpz5#37,Sicilian_Defense,Sicilian_Defense_Bowdler_Attack
04U6R,8/2p3k1/1p1p2pp/p2P4/P1P1b3/1Pq2N1P/6P1/3Q3K w - - 7 33,d1d4 c3d4 f3d4 g7f6 h1g1 f6e5 d4c6 e5f4,1778,75,93,543,crushing defensiveMove endgame veryLong,https://lichess.org/57ksAnW7#65,
04UFy,3r4/2R5/4P1k1/1p1q1pp1/1P6/6P1/2Q2P1K/8 w - - 0 46,e6e7 d8h8 h2g1 d5h1,1378,75,80,232,endgame mate mateIn2 short,https://lichess.org/aOo4kOWj#91,
04UH5,8/3R1k2/pp4rp/b7/4R3/5P1K/8/8 b - - 6 47,f7g8 e4e8,1249,124,60,31,endgame mate mateIn1 oneMove,https://lichess.org/ho0TSxi9/black#94,
04UHZ,5r1k/6q1/3pQ3/p1pPp3/1p2Pp1r/1P1P1Pb1/P3R1RN/7K b - - 0 47,h4h2 g2h2 g3h2 e2h2,1653,111,53,11,crushing middlegame short,https://lichess.org/vefs2m4v/black#94,
