06pgY,r4kr1/pp3p1p/7q/2N4B/3n4/3Q2B1/PPP2Pp1/R5K1 b - - 0 25,h6h5 g3d6 f8g7 d3d4,1497,105,52,16,advantage middlegame short,https://lichess.org/B2gQNSMO/black#50,
06pjp,3r2k1/1r1q1p2/p4Q1p/1p4p1/2p5/6P1/PP2RPP1/4R2K b - - 0 29,d7d6 e2e8 d8e8 e1e8,1231,75,56,248,crushing endgame short,https://lichess.org/6zSRiCzE/black#58,
06po1,r5k1/6pp/p4bq1/Pp1p4/2p1rR2/2P1PQ2/1B4P1/R5K1 b - - 11 32,e4f4 f3d5 g6f7 d5a8,1570,75,92,686,crushing fork middlegame short,https://lichess.org/eG0ObjTZ/black#64,
06pqG,6k1/R6R/2b2rBp/8/8/1pp4P/1P3PP1/6K1 w - - 2 39,g6b1 c3c2 b1c2 b3c2 a7a1 g8h7,1672,74,93,1234,advancedPawn crushing endgame long trappedPiece,https://lichess.org/bGb385s4#77,
06pyN,r1b2rk1/pp5p/2p1pqpQ/2np3N/2P5/3B4/P4PPP/1R2R1K1 b - - 7 20,g6h5 h6h7,1089,76,97,1637,kingsideAttack mate mateIn1 middlegame oneMove,https://lichess.org/LAHbywY0/black#40,
06q4r,r2r2k1/5pp1/p3p2p/2qpB3/4n3/P2Q3P/1PP2PPK/1R3R2 b - - 3 22,e4f2 d3g3 f7f6 e5f6,1966,115,35,15,crushing middlegame pin short,https://lichess.org/qfjVfZsw/black#44,
06q4t,r4r2/pppqp3/2npb1kP/6N1/4Pp2/P1PPQ3/2P2PB1/R3K2R w KQ - 2 18,e3f3 e6g4 f3h3 g4h3 g2h3 d7e8,1891,117,83,20,advantage defensiveMove long middlegame trappedPiece,https://lichess.org/0WbfT4jf#35,Modern_Defense,Modern_Defense_Other_variations
06qKJ,r5k1/1rpq1pp1/7p/p2pPn2/3B1P2/P2QP3/1P4PP/2R2RK1 w - - 0 25,e3e4 d5e4 d3e4 d7d4 e4d4 f5d4,1646,78,79,49,advantage discoveredAttack kingsideAttack long middlegame,https://lichess.org/bcmC1Mpy#49,
06qRA,3q2k1/7p/p5pb/1p2pp2/2rP4/2N1P2P/PP1Q2P1/3R2K1 w - - 2 28,d4e5 d8d2 d1d2 h6e3,1569,76,83,149,capturingDefender crushing endgame short,https://lichess.org/D7vDqZM2#55,
06qSd,1k5r/1pp2pp1/2n3r1/1QNp2q1/3Pp2p/P1P1P1P1/5P1P/R3R1K1 b - - 0 22,b7b6 b5a6 b6c5 d4c5 c6b4 a6b5 g6b6 c5b6,2488,116,80,40,crushing fork middlegame sacrifice veryLong,https://lichess.org/SRaJJiyO/black#44,
06qUM,r4rk1/1b1p1pbp/n2Pp1p1/1Np5/P1B1n2q/4P3/1P1N1PPP/R1BQ1RK1 w - - 7 14,f2f3 e4d2 c1d2 h4c4,1731,89,52,39,advantage capturingDefender discoveredAttack middlegame short,https://lichess.org/zbRTEbQ4#27,Benko_Gambit,Benko_Gambit_Other_variations
06qUU,8/8/p3k1p1/Pp2p2p/1P2K2P/5P2/6P1/8 w - - 0 37,g2g4 g6g5 h4g5 h5h4,1921,74,86,339,crushing defensiveMove endgame pawnEndgame short,https://lichess.org/GXx4m1Uk#73,
06qnP,2r5/2p1kp1N/bpQpq1pP/2r3P1/p3PP2/P7/1PPR4/2K4R w - - 1 28,f4f5 e6a2 f5f6 e7e6,2441,77,92,2487,crushing middlegame short,https://lichess.org/kziGkxIN#55,
06qs0,r2q1rk1/pp3ppp/2p1bn2/2P5/1P2N3/P2Pn1P1/1B2Q1BP/R4RK1 b - - 1 17,e3f1 e4f6 g7f6 a1f1,1765,78,66,48,crushing intermezzo middlegame short,https://lichess.org/Dsf42aLf/black#34,English_Opening,English_Opening_Kings_English_Variation
06qwL,rq4k1/pp3ppp/n3pb2/1N1pn3/1Pr2B2/P1N3Q1/2P2PPP/R3R1K1 w - - 11 20,e1e5 c4f4,1529,81,79,93,advantage middlegame oneMove,https://lichess.org/GDQfd3E0#39,
06qxl,8/7b/7P/2p2PB1/6P1/1pk1p3/4K3/8 b - - 0 46,b3b2 g5f6 c3c4 f6b2,1406,76,79,638,bishopEndgame crushing deflection endgame short skewer,https://lichess.org/zwmiaD29/black#92,
06qyD,6k1/pR5p/1bp2Kp1/4Pp2/8/2P5/PPr4P/8 b - - 4 35,c2b2 b7b8 b6d8 b8d8,1389,78,31,105,endgame mate mateIn2 short,https://lichess.org/24EcYaK4/black#70,
06r6q,1rbq1rk1/pp3ppp/4pn2/2b5/2Pp1P2/1P1P2P1/PB4BP/RN1QK2R w KQ - 3 12,b2a3 c5a3 b1a3 d8a5 d1d2 a5a3,1441,106,30,30,advantage exposedKing fork long middlegame,https://lichess.org/ZtWqmZbD#23,Bird_Opening,Bird_Opening_Dutch_Variation
06rHV,1k1r4/1pp1p3/6p1/1N6/5Pp1/P4n2/1PP1K2R/3R4 b - - 0 23,d8d1 h2h8 d1d8 h8d8,1243,77,97,1556,endgame mate mateIn2 short,https://lichess.org/D6sevKno/black#46,
06rUI,8/1p3p1k/5Pp1/6rp/7P/8/PPP5/1K2R3 w - - 1 33,e1e7 g5g1 e7e1 g1e1,600,110,89,655,backRankMate endgame mate mateIn2 rookEndgame short,https://lichess.org/MinCTMil#65,
06rX7,r6r/1pN1kppp/p4n2/4p3/3nq1b1/2P1B3/PP3PPP/2RQKB1R w K - 1 15,d1a4 d4f3 g2f3 e4a4,1427,137,100,14,crushing discoveredAttack middlegame short,https://lichess.org/CWUHRdYm#29,Sicilian_Defense,Sicilian_Defense_Lowenthal_Variation
06rZc,r2q1r2/1pp3k1/3p3p/p1bNpnpQ/2P5/P2P2P1/1P3PPN/R4RK1 w - - 0 18,g1h1 c5f2 h5h3 f5g3 h3g3 f2g3,1705,81,87,44,crushing fork long middlegame,https://lichess.org/WNCa2Kcf#35,English_Opening,English_Opening_The_Whale
06reC,8/6p1/5k1p/8/4RK1P/3r2P1/5P2/8 w - - 0 38,g3g4 g7g5 h4g5 h6g5,1137,78,89,74,endgame mate mateIn2 rookEndgame short,https://lichess.org/8uE62ECG#75,
06rrU,4rr2/ppp2qpk/3p3p/4pn2/3b4/P1NP1R1P/1PPB2PK/4RQ2 w - - 0 23,f3f5 f7f5 f1f5 f8f5,611,109,71,172,advantage middlegame short,https://lichess.org/2bZVceOE#45,
06rsz,4r1k1/1Nn1rp2/2P2bpp/p2pq3/1p1N4/P2QPP2/1P4PP/2R1R2K w - - 5 29,b7a5 e5d4 d3d4 f6d4,1668,210,100,5,crushing middlegame short,https://lichess.org/N83TzYZB#57,
06rtm,3r1rk1/1bq2p1n/p3p1pP/1p2P3/3R1P1P/2N1P3/PPQ1B3/4K1R1 w - - 0 22,g1g6 f7g6 d4d8 f8d8,1073,75,100,185,advantage middlegame short,https://lichess.org/cLRbC8eW#43,
06rvM,3K4/2R5/3Pk3/8/8/6r1/6P1/8 w - - 2 54,d6d7 g3g8,969,92,100,72,endgame mate mateIn1 oneMove rookEndgame,https://lichess.org/Qm1qQDfk#107,
06rx1,5q1k/pp4rp/2p4Q/7R/2P1P3/2N5/PPP3PP/7K w - - 0 29,h2h3 f8f1 h1h2 f1g2,860,78,82,188,endgame mate mateIn2 short,https://lichess.org/aGDJ2ZmU#57,
06rzE,2r3k1/pp3b1p/5pp1/1P1p1q2/P2Q4/4PB2/5PPP/3R2K1 b - - 3 30,b7b6 f3g4 f5c2 g4c8,1755,73,96,9651,crushing endgame short skewer,https://lichess.org/q6HIYHDd/black#60,
06s4Z,r3r1k1/3q1pp1/p2p1bnp/2pP4/1p3P2/1P1QB2P/P1PN2P1/1R3RK1 w - - 4 21,d2e4 e8e4 d3e4 a8e8,2030,76,84,114,clearance crushing middlegame sacrifice short,https://lichess.org/ezUb6G4V#41,
06s4a,rn2k2r/ppp2ppp/4b3/3N4/3bq3/1Q4P1/PP2NP1P/R3KB1R b KQkq - 1 11,e4h1 d5c7 e8d8 c7e6,1524,500,100,0,equality fork middlegame short,https://lichess.org/f4jFoUaN/black#22,
06s5z,r4rk1/pbppqppp/B1n2n2/8/8/P1N2N2/1PQ2bPP/R1B1R1K1 w - - 0 15,g1f2 e7c5 c1e3 f6g4 f2g3 g4e3,2001,75,92,210,advantage deflection long middlegame,https://lichess.org/PdRK9uIM#29,English_Opening,English_Opening_Kings_English_Variation
06s8F,6k1/p4ppp/4p3/2qpP1PP/8/2r5/P3QPK1/1R6 b - - 3 28,h7h6 b1b8 g8h7 g5g6 f7g6 h5g6 h7g6 e2g4 g6h7 g4e6 c5c6 e6g8 h7g6 b8f8,2409,98,85,55,attraction crushing defensiveMove endgame veryLong,https://lichess.org/PFIUmx7C/black#56,
06sAf,q3r1k1/2p2ppp/p2b4/1p6/3n4/3PB3/PPP1QPPP/RN4K1 w - - 6 17,e2d2 d4f3 g2f3 a8f3 b1c3 d6h2 g1h2 e8e5 e3g5 f3h5 h2g1 e5g5,1927,209,89,11,crushing kingsideAttack middlegame sacrifice veryLong,https://lichess.org/ZQQbr3BU#33,Ruy_Lopez,Ruy_Lopez_Morphy_Defense
06sDc,5r1k/7p/5qp1/3Q4/P2Pp3/8/1r3PPP/R4RK1 w - - 1 28,a1a2 f6f2 f1f2 b2b1 f2f1 b1f1,1484,77,92,826,endgame long mate mateIn3 sacrifice,https://lichess.org/J0otKMPT#55,
06sIm,r3kb1r/1pqb1pp1/7p/1p1Qp3/8/8/PPP2PPP/R1B1KB1R w KQkq - 2 12,f1b5 c7a5 c1d2 a5b5 d5b5 d7b5,1433,95,85,39,crushing long middlegame,https://lichess.org/PKq5pebj#23,Sicilian_Defense,Sicilian_Defense_Lasker-Pelikan_Variation
06sJq,8/7p/2k5/2p2pp1/P1K5/1P5P/6P1/8 w - - 0 50,a4a5 g5g4 a5a6 g4g3 a6a7 c6b7 a7a8r b7a8,2612,99,43,27,crushing endgame pawnEndgame veryLong,https://lichess.org/zzSHtN4x#99,
06sK0,4r1kR/8/8/pp3K2/1p1r4/8/P2n1P2/7R b - - 1 41,g8f7 h1h7,1176,77,95,1179,endgame mate mateIn1 oneMove,https://lichess.org/JiLD47qv/black#82,
06sVs,r1bq2rk/1p1n1pRn/p2p1b1B/2pPpN2/2P1P1Q1/2NB4/PP3PPP/R5K1 b - - 0 16,f6g7 h6g7 g8g7 g4g7,1129,76,94,2278,kingsideAttack mate mateIn2 middlegame short,https://lichess.org/Qtt8dLsm/black#32,French_Defense,French_Defense_Knight_Variation
06scC,8/pb1R2p1/7p/1qp1p3/6Q1/3R4/1P3kPP/7K w - - 10 41,g4d1 b7g2,1149,76,79,191,endgame mate mateIn1 oneMove,https://lichess.org/PRct9Noi#81,
06scF,2r3k1/1p4pp/p3p3/8/3p1nP1/8/PPr4P/1K1RQ3 w - - 0 29,d1d4 c2c1 e1c1 c8c1 b1c1 f4e2 c1d2 e2d4,848,79,96,7417,attraction crushing endgame fork veryLong,https://lichess.org/9mFK3bsh#57,
06sek,3rr1k1/pppb1ppp/8/8/4p2N/2BP3P/PPP2PP1/R4KR1 w - - 0 19,d3e4 d7b5 f1e1 e8e4,1194,79,94,3116,intermezzo mate mateIn2 middlegame short,https://lichess.org/7lKh1a6r#37,Russian_Game,Russian_Game_Other_variations
06shh,2r5/6k1/p3b3/1pRpNp2/1P1P1P1q/P7/4K3/4Q3 b - - 2 35,h4f4 e1g1 g7f6 g1g6 f6e7 g6g7 e7d6 e5f7,2437,86,83,246,crushing endgame exposedKing veryLong,https://lichess.org/tXguMXEo/black#70,
06skK,8/p2b3p/5k2/2P1R1p1/8/8/P5K1/8 w - - 3 33,e5d5 d7c6 g2f2 c6d5,1222,184,100,17,crushing endgame pin short,https://lichess.org/hPTpFDda#65,
06smt,2kr3r/pp4pp/8/2p1Q3/3p1P1q/3P4/PP5P/R1B1K2R w KQ - 1 20,e1f1 d8e8 e5f5 c8b8 c1d2 h8f8,1819,103,84,24,advantage defensiveMove long middlegame,https://lichess.org/Jds5jqyc#39,
06spS,2k4r/2p2p2/pp2pn2/3p3q/3P2n1/2P1PQB1/PP3PKN/6R1 w - - 3 27,h2g4 h5h3,1592,140,44,77,mate mateIn1 middlegame oneMove,https://lichess.org/YOtJ2mrU#53,
06su6,8/8/4p3/p1k1p1p1/4P3/1PK2PP1/8/8 w - - 2 54,c3b2 c5d4 b2a3 d4e3 a3a4 e3f3,1867,81,76,62,crushing endgame long pawnEndgame,https://lichess.org/J2wLoYNd#107,
06syA,r3q2k/pp3rpp/8/n4n2/7P/BBN2N2/PPP3PR/R2QK3 w Q - 2 19,e1f2 e8e3 f2f1 f5g3,1261,79,86,401,mate mateIn2 middlegame short,https://lichess.org/7sXoN7ue#37,Kings_Gambit_Accepted,Kings_Gambit_Accepted_Cunningham_Defense
06t6f,2r3k1/pp1b1p1r/4pPpq/3pP3/3P2Q1/2P2R2/P1B4P/5RK1 w - - 7 25,f3g3 h6h2,1265,114,100,67,kingsideAttack master mate mateIn1 middlegame oneMove,https://lichess.org/CcgPQghn#49,
06tBh,4N3/7R/K2kpp2/P3p3/4P1P1/5r2/7p/6b1 b - - 3 45,d6c6 h7c7,757,88,94,462,endgame master mate mateIn1 oneMove,https://lichess.org/yYlcPZ7P/black#90,
06tEF,r1b1r1k1/4bppp/p1n5/3qNn2/2pP1P2/P1P3PP/B7/R1BQK1R1 b Q - 2 18,f7f6 a2c4 d5c4 e5c4,1597,75,93,1904,advantage middlegame pin short,https://lichess.org/vIvRDIaq/black#36,Sicilian_Defense,Sicilian_Defense_Grand_Prix_Attack
06tGZ,4r3/4Pk2/p1r2bpp/1p1N1p2/8/5KPP/PP2R3/3R4 b - - 2 33,c6e6 e2e6 f7e6 d5c7,1552,74,95,13956,attraction crushing endgame short,https://lichess.org/zYbTUVsl/black#66,
06tOY,r1b2rk1/pp4pp/n1p1ppn1/8/2P1q3/2B2NPP/PP2BP2/R2Q1RK1 b - - 0 13,e6e5 e2d3 e4d3 d1d3,1352,75,92,1943,crushing master middlegame short trappedPiece,https://lichess.org/yLIbZsUt/black#26,Semi-Slav_Defense,Semi-Slav_Defense_Marshall_Gambit
06tPE,2r3k1/p4q1p/1p4p1/5p2/1Q2p3/7P/P4PP1/3R2K1 b - - 1 35,c8c5 d1d8 g8g7 b4d4 g7h6 d8d7,2032,74,90,258,advantage endgame long,https://lichess.org/zSUKtXYo/black#70,
06tUH,6r1/pppk4/3ppp2/4p3/2PNP1q1/7p/PP1Q3P/3R1RK1 w - - 0 24,g1h1 g4g2 d2g2 h3g2,2043,76,88,501,advancedPawn crushing endgame kingsideAttack short,https://lichess.org/OqIO9Jm9#47,
06tVi,2r3k1/p4ppp/4bq2/3p4/6r1/1P1BR1Q1/P1P2PPP/3R1K2 w - - 19 29,e3f3 g4g3 f3f6 g3d3 d1d3 g7f6,1436,75,90,1064,advantage intermezzo long middlegame,https://lichess.org/Xm756DwF#57,
06ti3,r2qr1k1/ppp1bB1p/6pB/4pn2/4N3/6Q1/PPP5/2K4R b - - 0 21,g8f7 g3b3 d8d5 b3d5,1769,146,91,26,mate mateIn2 middlegame short,https://lichess.org/yuBMp6kn/black#42,
06tpy,5rk1/p4ppp/1p1bpq2/8/3P2nN/P3P1P1/1B3PbP/3Q1RK1 w - - 0 20,g1g2 f6f2 f1f2 g4e3 g2f3 e3d1,1484,181,-76,7,advantage fork long middlegame sacrifice,https://lichess.org/9oAlGSTy#39,
06u87,1k1r1r2/2p5/Q1p4p/2P1qbp1/8/4p2P/P4PP1/1R3RK1 b - - 1 25,f5b1 f1b1 e5b2 b1b2,829,91,94,133,endgame mate mateIn2 short,https://lichess.org/imNuANNb/black#50,
06uCP,2k2r2/p5Q1/Pppqp1p1/6N1/1bPP4/7P/1P4P1/6K1 b - - 0 31,d6f4 g7b7 c8d8 g5e6,1895,74,95,6892,crushing endgame queensideAttack short,https://lichess.org/Rcv7pHrU/black#62,
06uNU,2r4k/6Np/p2p1qp1/3Q1p2/P1P1p3/7P/5PP1/5RK1 b - - 0 28,h8g7 d5b7 g7h6 b7c8,957,77,94,824,crushing endgame fork short,https://lichess.org/V8JkWpHQ/black#56,
06ugD,r2q2nr/ppBk1Bpp/8/2pN4/2NpP3/8/PPb2PPP/R3K2R b KQ - 1 17,d8h4 c4e5 d7c8 f7e6,1325,74,96,8972,mate mateIn2 middlegame short,https://lichess.org/l3tiIHeS/black#34,Caro-Kann_Defense,Caro-Kann_Defense_Other_variations
06uiQ,3r1k2/p5pp/2p2p2/P7/1Rq5/8/1P3PPP/6K1 w - - 0 32,b4c4 d8d1,607,98,87,373,backRankMate endgame mate mateIn1 oneMove rookEndgame,https://lichess.org/fQt5WaDb#63,
06ujk,r2q1rk1/1pp2ppp/p1b2n2/4P3/8/4R3/PPBB1P2/R2Q2K1 b - - 0 19,f6d5 c2h7 g8h8 e3h3 d5f4 d2f4 d8d1 a1d1,2388,88,90,371,crushing middlegame quietMove veryLong,https://lichess.org/Yv3zeSP5/black#38,Ruy_Lopez,Ruy_Lopez_Berlin_Defense
06umd,3rr1k1/pb3p1P/4p2B/8/8/3B4/qP1bQ1PP/4R2K b - - 0 24,g8h8 e2e5 f7f6 e5f6,1164,76,89,145,mate mateIn2 middlegame short,https://lichess.org/NHjcKxS1/black#48,
06umr,rn1q1rk1/p3bppp/b1p1pn2/2Pp4/3P4/P2BPN2/5PPP/RNBQ1RK1 w - - 0 11,c1d2 a6d3 d2a5 d8a5,1116,75,99,1197,crushing hangingPiece opening short,https://lichess.org/PRNu15WM#21,Queens_Gambit_Declined,Queens_Gambit_Declined_Other_variations
06urT,r5k1/2P2p1p/1n1q4/5p2/p3R3/P1Q5/BP3PPP/6K1 w - - 0 31,e4h4 d6d1 c3e1 d1e1,618,81,100,187,endgame mate mateIn2 short,https://lichess.org/6BCxyKmr#61,
06uty,5k2/1p1q1p1p/pP5P/P1prPp2/3nQ3/8/6P1/3R1RK1 w - - 0 38,e4h4 d4e2 g1f2 d5d1 f1d1 d7d1,1635,183,100,8,crushing discoveredAttack endgame long,https://lichess.org/r9s1r5Fv#75,
06uwS,8/8/5p1p/5k2/4p1bP/6K1/2N2P2/8 b - - 2 52,g4d1 c2e3 f5e6 e3d1,1082,75,98,558,crushing endgame fork short,https://lichess.org/nsd3U9gQ/black#104,
06v9l,8/8/P1R3p1/5k1p/r6P/8/8/6K1 b - - 0 43,a4h4 c6c5 f5e6 c5a5,1747,77,97,74,crushing endgame rookEndgame short,https://lichess.org/OQqfh2lS/black#86,
06vI3,4rrk1/p4pp1/1p1p1n1p/2pP2q1/2P1PRP1/1P4Q1/P5PN/5RK1 w - - 3 24,h2f3 f6h5 f3g5 h5g3,2129,74,95,1855,crushing middlegame short,https://lichess.org/5DGC8x2e#47,
06vMr,8/8/ppp3p1/4p1k1/PPP1P3/5PK1/8/8 b - - 0 46,c6c5 a4a5 b6a5 b4b5 a6b5 c4b5 c5c4 b5b6 c4c3 b6b7 c3c2 b7b8q,2114,101,85,35,advancedPawn crushing endgame pawnEndgame promotion veryLong,https://lichess.org/2lfD9QPJ/black#92,
06vNW,1n3rk1/Q4ppp/1p6/6bb/4N3/P3P1R1/1q1B1P1P/R3K3 w Q - 0 21,d2c3 b2e2,1363,87,66,39,mate mateIn1 middlegame oneMove,https://lichess.org/L2p3DBvd#41,
06vQF,rn3rk1/pp3ppp/2p1pn2/2b5/3q4/2N1BB1P/PPP1QPP1/1R2R1K1 b - - 5 14,d4b4 a2a3 b4b6 c3a4 c5e3 a4b6,1768,76,87,55,advantage long middlegame,https://lichess.org/G8y5vhmB/black#28,Scandinavian_Defense,Scandinavian_Defense_Main_Line
06vSn,1r3r1k/ppq2p2/4pNp1/4Pn2/5n2/1R5Q/P1P2PPP/5R1K b - - 1 24,f4h3 b3h3 f5h4 h3h4 h8g7 h4h7,1244,77,92,443,exposedKing hookMate kingsideAttack long mate mateIn3 middlegame,https://lichess.org/6TIIFBO2/black#48,
06vTI,2k1r2r/p1p2pp1/2P5/3q3p/PQ1pb3/6P1/5PBP/R3R1K1 b - - 4 24,e4g2 b4b7 c8d8 b7a8,1287,101,88,50,mate mateIn2 middlegame queensideAttack short,https://lichess.org/V8PlEiSd/black#48,
06vTw,r2qkb1r/pp3ppp/2n5/1Bp5/8/5b2/PPP2PPP/R1BQK2R w KQkq - 0 10,d1f3 d8a5 c2c3 a5b5,1666,95,100,25,crushing fork middlegame short,https://lichess.org/KyoKRgCI#19,Scandinavian_Defense,Scandinavian_Defense_Other_variations
06vXQ,rnq2rk1/pp1bbppp/3p1n2/2p1p3/B3P3/2NPBN1P/PPP1QPP1/R4RK1 b - - 2 10,d7h3 g2h3,995,80,90,230,advantage middlegame oneMove,https://lichess.org/Vah6fAvv/black#20,Philidor_Defense,Philidor_Defense_Other_variations
06vXY,8/5k1p/6p1/8/5P2/p1KB2PP/Nr6/8 b - - 1 49,b2a2 d3c4 f7f6 c4a2,806,96,92,553,crushing endgame fork short,https://lichess.org/aZW0eJzZ/black#98,
06vd7,8/p4kp1/1p1bp1n1/7Q/2PBnP1p/q2P3P/P5P1/R1R4K w - - 1 25,f4f5 e4g3 h1g1 g3h5,1461,116,27,11,crushing fork middlegame short,https://lichess.org/Iu0PbaUo#49,
06vta,r2q2k1/1p3rp1/p1nb4/3Qp1N1/1P2p1b1/P5P1/2P2PK1/R1B4R b - - 5 21,d8e7 d5e4 g4f3 g5f3,2669,93,74,205,crushing middlegame short,https://lichess.org/6E8U9CdP/black#42,
06vv6,rn2k2r/ppq1ppbp/3p2p1/1PpP4/Q3n3/8/PP3PPP/R1B1KBNR b KQkq - 1 10,e4f6 b5b6 c7d7 f1b5,1480,77,85,103,advantage clearance discoveredAttack opening pin short,https://lichess.org/YNLLVzoi/black#20,Benoni_Defense,Benoni_Defense_Hromadka_System
06w9j,r4rk1/ppp2ppp/4b3/4P1q1/3RQ1Pn/2B4P/P1B2P2/5RK1 b - - 2 19,g5e5 e4h7,1559,84,63,165,kingsideAttack mate mateIn1 middlegame oneMove,https://lichess.org/zwtI09ic/black#38,Scotch_Game,Scotch_Game_Scotch_Gambit
06wEM,4k3/2R5/6p1/4K3/6pr/5P2/2P5/8 w - - 2 42,f3f4 g4g3 e5e6 e8f8 c7c3 h4g4,2255,128,95,18,crushing endgame long rookEndgame,https://lichess.org/vsDsU8a3#83,
06wFF,rn1qk1nr/ppp1bppp/8/3pp3/P5bP/5P2/1PPPP3/RNBQKBNR w KQkq - 1 5,f3g4 e7h4 h1h4 d8h4,980,149,100,22,mate mateIn2 opening short,https://lichess.org/zEdTTzdX#9,Ware_Opening,Ware_Opening_Other_variations
06wNe,r1b1kb1r/ppp1qppp/2n5/4p3/2BP4/2P2Q2/P1P2PPP/R1B1K1NR w KQkq - 4 8,c1e3 e5d4 c4f7 e7f7 f3f7 e8f7,1690,235,14,3,crushing long opening,https://lichess.org/7AvUixJL#15,Scandinavian_Defense,Scandinavian_Defense_Modern_Variation
06wOP,4rr1k/p5pp/8/2pb1p2/5Q1b/P2P4/1PP2P2/1RB1K3 w - - 1 24,c1e3 g7g5 f4d6 f5f4 e1d2 f4e3,2578,78,74,125,advantage long middlegame pin,https://lichess.org/EjzBjcpN#47,
06wQr,8/5p2/pB4p1/P4p1p/3p1P1P/2k5/4K3/8 w - - 3 55,b6c7 c3c2 c7b6 d4d3,1855,75,92,530,bishopEndgame crushing endgame short,https://lichess.org/F8x5toMG#109,
06wiJ,r3k1nr/ppp1bppp/2nq4/7b/2Bp4/2PQ1N1P/PP3PP1/RNB1R1K1 b kq - 2 11,e8c8 d3f5 c8b8 f5h5,1218,75,93,3082,advantage fork opening short,https://lichess.org/TjjajQrj/black#22,Italian_Game,Italian_Game_Scotch_Gambit
06wxC,4rrk1/1pp3pp/p1n3p1/3p2P1/3P2P1/2P1PR2/PPB5/R2QKNq1 w - - 5 23,e1d2 g1g2 d1e2 g2f3 e2f3 f8f3,1515,74,95,9429,advantage long middlegame,https://lichess.org/wgMOT0iQ#45,
06wxz,6r1/2k2qr1/p1p1p2p/PpPpPn2/1P3P2/2P5/1KBQ2pR/6R1 w - - 2 50,h2g2 g7g2 g1g2 f5e3 d2e3 g8g2,2329,80,90,841,attraction crushing deflection long middlegame,https://lichess.org/C5sP5h4e#99,
06wyM,2kr3r/ppp3pp/bbn2p2/4p3/8/2B2NPP/PP3NB1/R3R1K1 w - - 4 17,a1d1 d8d1 e1d1 e5e4,2050,134,82,18,advantage master middlegame pin short,https://lichess.org/fWdVWjcM#33,Zukertort_Opening,Zukertort_Opening_Old_Indian_Attack
06x2K,3r2k1/2p2ppp/p5q1/1p2r3/8/2P2Q2/PP3PPP/3R1RK1 b - - 1 24,d8d1 f3a8 d1d8 a8d8 e5e8 d8e8,1629,81,85,46,endgame long mate mateIn3,https://lichess.org/03OrLBES/black#48,
06x2p,8/8/4k3/3npp2/8/4KR2/8/8 w - - 2 61,e3d3 e5e4 d3e2 e4f3,893,79,100,497,crushing endgame fork short,https://lichess.org/DzrOHPPW#121,
06x7s,r3r1k1/3q1ppp/p2p4/1p1Q4/8/P7/1P3PPP/2RR2K1 w - - 3 24,d5d6 e8e1 d1e1 d7d6,1105,76,94,1685,advantage deflection endgame short,https://lichess.org/5s4cuUmX#47,
06xII,5rk1/4ppb1/p5pp/3p4/3P2nP/q1r2N2/3BQPK1/R6R b - - 1 27,c3f3 a1a3 f3f2 e2f2 g4f2 g2f2,1692,75,89,854,advantage long middlegame,https://lichess.org/85le6XlT/black#54,
06xIV,5rk1/2p1b1p1/3p3p/P5pP/2P1q1b1/4B1P1/1P1Q1r1R/R3K3 w Q - 0 29,h2f2 e4h1 f2f1 f8f1,1593,110,-27,15,mate mateIn2 middlegame short,https://lichess.org/KBWLhfQ0#57,
06xLG,r3k2r/p1p2p2/PpPp1n2/1P1P4/3QPpb1/1N6/1B3KBq/R7 b kq - 1 26,f6h5 d4h8 e8e7 b2f6 h5f6 h8h2,1855,75,90,1047,crushing hangingPiece long middlegame,https://lichess.org/BM9YqfUa/black#52,
06xMJ,4r1k1/ppp1nppp/8/8/2BP2n1/1PBQ1N1q/P4P2/R5K1 w - - 2 19,f3e5 h3h2 g1f1 h2f2,1187,76,100,390,kingsideAttack mate mateIn2 middlegame short,https://lichess.org/iMbuDXyU#37,French_Defense,French_Defense_Steiner_Variation
06xNO,1r2rk2/pp4p1/4pq2/3p4/8/2P1R1Q1/PP3P2/5R1K b - - 4 31,f8e7 e3f3 e7d7 f3f6 g7f6 g3f4 e8h8 h1g2 b8g8 g2f3,1830,273,100,3,crushing defensiveMove endgame veryLong,https://lichess.org/VbBanjAV/black#62,
06xNZ,1k1rr3/2p1qpb1/p1p3pp/3n4/2R4P/4PP1B/PP1Q1P1B/1K5R w - - 0 21,c4c6 d5c3 d2c3 g7c3,2071,75,90,893,advantage middlegame queensideAttack short,https://lichess.org/QW6O8R25#41,
06xX4,7r/4p2p/3p1bp1/4n3/6k1/3B2PR/PP1Q3P/6K1 w - - 5 40,d3f1 e5f3 g1g2 f3d2,690,77,100,908,crushing endgame fork short,https://lichess.org/hFIxJ4KM#79,
06xYR,r1b1k2r/3n1ppp/pqn1p3/3pP3/Pb1P1P2/1pN2N2/4B1PP/R1BQ1RK1 w kq - 1 16,d1b3 c6d4 f3d4 b6d4,1593,75,91,1216,crushing middlegame short,https://lichess.org/GiM9qPtx#31,French_Defense,French_Defense_Tarrasch_Variation
06xcF,r1b3k1/2q4p/p3p1pQ/3N1r2/8/8/PP3PPP/3RR1K1 b - - 0 23,e6d5 e1e8 f5f8 h6f8,855,79,100,103,mate mateIn2 middlegame short,https://lichess.org/6ZmTgKvx/black#46,
06xcR,8/1r3ppk/1pN2b1p/1P1PpN2/4P2P/6R1/5PPK/1r6 b - - 8 34,b1b5 f5d6 b5d5 e4d5,2049,74,89,768,advantage endgame fork short,https://lichess.org/lQHuJ0s3/black#68,
06xcs,8/p4k1p/1p3P2/2p5/3p4/7P/r2KR1P1/5R2 w - - 3 37,d2d3 c5c4 d3c4 a2e2,1468,198,100,15,deflection endgame equality rookEndgame short,https://lichess.org/DLe2wxIE#73,
06xjz,8/8/7p/1p3k2/2p4P/P1P1K3/8/8 b - - 1 53,f5e5 h4h5 e5d5 e3f4 d5c5 f4f5,2163,78,92,3974,crushing defensiveMove endgame long pawnEndgame quietMove zugzwang,https://lichess.org/VLP7GYBJ/black#106,
06xmE,8/7p/p2Bp1p1/1k2P3/2p1K1P1/2P4P/P4b2/8 w - - 0 36,e4f3 f2e1 f3e4 e1c3,1781,76,96,2395,bishopEndgame crushing endgame master short,https://lichess.org/MR7bFdci#71,
06xoU,r5k1/1R3p1p/6p1/4B3/3pP1P1/P1rbb2P/8/4RB1K w - - 0 42,e1e3 d4e3 e5c3 d3e4,2056,108,68,23,advantage capturingDefender middlegame short,https://lichess.org/cKnFyYMH#83,
06xpa,4qk2/p7/1p1Q1p1P/2p2p2/8/P2p4/1P6/5K2 b - - 3 51,e8e7 d6e7 f8e7 h6h7,1565,75,85,285,advancedPawn crushing endgame queenEndgame short,https://lichess.org/7kgY22Of/black#102,
06xpi,4rk2/5pp1/6p1/Q2p1P2/1r6/3Bq3/PPP4P/3K1R2 b - - 0 34,b4b2 a5a3 f8g8 a3b2,1373,110,56,30,advantage endgame fork short,https://lichess.org/L7pVEpIf/black#68,
06xqS,r1b1kb1r/pppp1ppp/5n2/1BP5/8/q7/P2B1PPP/1R1QK1NR b Kkq - 0 11,c7c6 d1e2 f8e7 d2b4 a3b4 b1b4,2223,78,88,120,advantage long opening pin trappedPiece,https://lichess.org/6BYoWkdO/black#22,English_Opening,English_Opening_Kings_English_Variation
06xqu,4r2k/ppp4p/3q4/2nPNr2/3Q1P2/8/PPP4P/2K3R1 b - - 3 21,f5f6 e5f7,1080,82,94,251,mate mateIn1 middlegame oneMove pin,https://lichess.org/OdE7Skk9/black#42,
06xt9,8/k4R2/p1r5/2N2pP1/4pP2/4K3/1r6/8 b - - 3 44,a7b6 c5a4 b6b5 a4b2,1472,77,95,10460,crushing endgame fork master masterVsMaster short,https://lichess.org/WFUZ6cf7/black#88,
06xzT,4r1k1/p5bp/4r1p1/2p2B2/2Pq1n2/1P3Q2/P6P/3R1R1K b - - 0 24,d4e3 f5e6 e3e6 f3f4,1454,75,86,202,advantage middlegame short,https://lichess.org/gLijlGi9/black#48,
06yFQ,4rrk1/pp4pp/3p1bp1/2pP4/2P5/5P2/PP4PP/1RB1R1K1 w - - 4 18,c1f4 f6d4 g1f1 e8e1 b1e1 f8f4,1884,76,85,95,advantage endgame kingsideAttack long,https://lichess.org/1O33WAkg#35,Ruy_Lopez,Ruy_Lopez_Steinitz_Defense
06ySG,8/1k5p/p4p2/4BN2/2b5/4P3/6P1/3K4 b - - 0 41,f6e5 f5d6 b7c6 d6c4,1261,300,100,6,crushing endgame fork short,https://lichess.org/31ajrdGM/black#82,
06ySd,2rqr1k1/p5pp/bp2pn2/3p1p2/1BPP4/P2B1P1P/1P4P1/2RQ1RK1 w - - 2 20,c4d5 c8c1 d1c1 a6d3,1693,75,97,12301,advantage middlegame short,https://lichess.org/3DtSINT1#39,
06yUK,r4rk1/1p2bppp/p1bp1n2/3Np3/P1P1P3/1q1Q2P1/1B3PBP/R2R2K1 b - - 1 17,b3d3 d5e7 g8h8 d1d3,1317,81,85,75,crushing hangingPiece intermezzo middlegame short,https://lichess.org/gyASw1Kn/black#34,Sicilian_Defense,Sicilian_Defense_Staunton-Cochrane_Variation
06yZy,1r4k1/4ppbp/3p2p1/2pP4/4P1n1/1PN5/2PB1PPP/5RK1 w - - 1 21,f2f3 g7d4 g1h1 g4f2 f1f2 d4f2,1093,78,74,55,advantage endgame kingsideAttack long,https://lichess.org/iRuv45Q0#41,
06ybl,8/6p1/R4p1k/4p2p/2r1K2P/3N1PP1/8/8 w - - 2 49,e4d5 c4d4 d5e6 d4d3,1149,80,58,75,crushing endgame fork short,https://lichess.org/rsvsBSX1#97,
06ycI,8/8/2p2p2/k1p1p1p1/pPPrP1Pp/P1KR1P1P/8/8 b - - 0 47,c5b4 a3b4 a5b6 d3d4 e5d4 c3d4,1535,173,100,8,crushing endgame long rookEndgame,https://lichess.org/M01QLycp/black#94,
06ydp,3r2k1/1b3pbp/1N4p1/3P1p2/1Q6/6P1/qP3PBP/4R1K1 w - - 1 34,b4c4 a2a5 b2b4 a5b6,2005,74,93,2560,advantage fork master middlegame short,https://lichess.org/IlLTbb5l#67,
06yli,6k1/p4ppp/b3p3/P2p4/1RpP4/4PP1P/3rn1PK/1B6 b - - 1 29,h7h6 b4b8 a6c8 b8c8,876,152,54,21,endgame mate mateIn2 short,https://lichess.org/SToCqUch/black#58,
06ymP,rn1qkb1r/ppp1pppp/5n2/5b2/3Pp3/2N2P2/PPP1Q1PP/R1B1KBNR b KQkq - 1 5,d8d4 e2b5 f5d7 b5b7,1320,86,79,62,advantage fork opening short,https://lichess.org/WCceioiA/black#10,Blackmar-Diemer_Gambit,Blackmar-Diemer_Gambit_Vienna_Variation
06ymg,3r1rk1/1p3p1p/p2bpBp1/3p3q/5Q2/5P2/N3BP1P/R5RK w - - 1 25,f4d4 h5h2,1119,93,83,26,kingsideAttack mate mateIn1 middlegame oneMove,https://lichess.org/ICMe3zYa#49,
06z05,r1b1r1k1/ppp2p1p/5Bp1/4P2q/5R2/2P1Q3/Pn4PP/RN4K1 b - - 0 19,b2c4 f4c4 h5d1 g1f2,1780,76,87,1665,crushing hangingPiece middlegame short,https://lichess.org/4Eu48oKV/black#38,Kings_Gambit,Kings_Gambit_Other_variations
06z3g,5n1R/3kbpp1/p2pb3/qp4P1/3QPB2/P1r5/1PP1B3/1K6 w - - 0 24,d4c3 a5c3 b2c3 f8g6 h8a8 g6f4,1680,77,80,52,advantage fork long middlegame,https://lichess.org/5UiNfLCx#47,
06zHm,3R1bk1/5p2/4b1pq/p1Q5/8/8/1PP5/4K3 b - - 5 36,h6f4 c5f8 g8h7 f8h8,997,77,81,403,endgame mate mateIn2 short,https://lichess.org/0aptRTSa/black#72,
06zQg,r2r4/RR6/5kp1/p7/P3Kp2/8/6PP/8 b - - 1 36,g6g5 b7b6 d8d6 b6d6,1694,76,94,8015,endgame mate mateIn2 rookEndgame short,https://lichess.org/bsDcGQGy/black#72,
06zU9,2r1r1k1/Rp3pp1/6qp/1N1p1n2/3Pn3/3QPN1P/5PP1/1R4K1 w - - 7 24,f3e5 e8e5 d4e5 f5h4 g2g3 h4f3,1623,323,67,4,crushing long middlegame sacrifice,https://lichess.org/94aBXDGk#47,
06zUu,r2qnrk1/pb3ppp/2pb4/4R3/8/2NB4/PPP3PP/R1BQ3K w - - 1 15,d3h7 g8h7 e5h5 h7g8,1345,87,73,49,advantage hangingPiece opening short,https://lichess.org/bFtbECp9#29,Sicilian_Defense,Sicilian_Defense_Classical_Variation
06zbS,6k1/2R2p1p/8/3br3/1P1N1p1P/6P1/2P2P2/6K1 w - - 1 30,c7c5 e5e1 g1h2 e1h1,961,96,95,158,endgame mate mateIn2 short,https://lichess.org/U7285HLi#59,
06zho,r5kr/p3pp1p/6pP/1p1q1B2/8/8/PP1Q1PP1/2KR3R b - - 0 21,d5f5 d2d8 a8d8 d1d8,761,122,100,45,endgame mate mateIn2 sacrifice short,https://lichess.org/QT31CO7k/black#42,
06zk6,r5k1/4r1p1/b1pNp2p/p1P1n2B/P7/8/3K2PP/1R2R3 b - - 3 24,e5c4 d2c3 c4d6 c5d6,1946,89,75,24,advantage defensiveMove middlegame short,https://lichess.org/ESsyVOax/black#48,
06zlu,1kr4r/1p1n1p2/p4p2/3p1P2/1Q1N2P1/1P5P/PK2R1q1/3R4 b - - 17 33,g2h3 b4d6 b8a8 d6d7 h3c3 b2b1,1851,76,91,891,crushing fork long middlegame,https://lichess.org/sQ0yYFTm/black#66,
06zsb,8/2r1kpp1/p3p2p/8/1p3P2/1Pq3P1/P1P1Q2P/2KR4 w - - 1 28,d1d2 c3a1,1138,80,58,136,endgame mate mateIn1 oneMove,https://lichess.org/es1uJiLA#55,
06zvj,r3k2r/pppq1pp1/2n1b2p/2bnP1B1/2B5/5N2/PPP1QPPP/RN3RK1 w kq - 0 10,g5h4 d5f4 e2e4 e6c4,1796,74,87,200,advantage discoveredAttack middlegame short,https://lichess.org/LGH9laLY#19,Bishops_Opening,Bishops_Opening_Ponziani_Gambit
07046,r5k1/1p3p1p/3Pp1p1/3p4/3b4/6P1/R4PKP/R7 b - - 0 32,a8d8 a2a8 d4a1 a8d8,695,96,92,183,advantage endgame pin short,https://lichess.org/vIhgg5d5/black#64,
070D5,5b2/3R4/5rk1/7R/4p1K1/p2pP3/8/8 w - - 3 55,h5a5 f6d6 d7d6 f8d6,2103,83,71,31,crushing endgame master short,https://lichess.org/s9WkL8jD#109,
